<?xml version="1.0" encoding="iso-8859-1"?>
<!-- PHP2Go Examples : searchform.example.xml, used at searchform.example.php -->
<!DOCTYPE form SYSTEM "..\..\docs\dtd\php2go_forms.dtd">
<form>
	<section name="PHP2Go Search Form Example" id="section">
		<editfield name="code" label="Code" upper="T" autotrim="T">
			<search alias="p.code" operator="EQ"/>
		</editfield>
		<editfield name="short_desc" label="Short Description">
			<search alias="p.short_desc" fieldfunc="trim(%s)" valuefunc="trim"/>
		</editfield>
		<combofield name="category" label="Category" multiple="T" size="2">
			<option value="1" caption="Books"/>
			<option value="2" caption="DVD"/>
			<search alias="p.id_category" datatype="INTEGER"/>
		</combofield>
		<rangefield name="added" label="Date Added" surroundtext="From %s to %s" ruleequal="T" mask="DATE">
			<editfield/>
			<editfield/>
			<search alias="p.date_added"/>
		</rangefield>
		<rangefield name="price" label="Price" surroundtext="Between %s and %s">
			<editfield mask="FLOAT-10:2"/>
			<editfield mask="FLOAT-10:2"/>
			<search alias="p.price"/>
		</rangefield>
		<combofield name="amount" label="Available Amount">
			<option value="10" caption="More than 10"/>
			<option value="50" caption="More than 50"/>
			<option value="100" caption="More than 100"/>
			<search alias="p.amount" operator="GOET" datatype="INTEGER" descsource="VALUE"/>
		</combofield>
		<checkfield name="active" caption="Active" default="T">
			<search alias="p.active"/>
		</checkfield>
		<buttons>
			<button name="submit" type="SUBMIT" value="Submit"/>
			<button name="reset" type="RESET" value="Reset"/>
		</buttons>
	</section>
</form>